
"Akpati, B. N. (1978). Geologic structure and evolution of the Keta basin, West Africa. Bulletin of the Geological Society of America, 89, 124–132. https://doi.org/10.1130/0016-7606(1979)90<889:GSAEOT>2.0.CO;2"
"Amajor, L. C. (1991). Aquifers in the Benin Formation ( Miocene Recent ), Eastern Niger Delta , Nigeria?: Lithostratigraphy , Hydraulics , and Water Quality. Environmental Geology Water Sciences, 17(2), 85–101."
"Amorosi, A., Centineo, M. C., Colalongo, M. L., & Fiorini, F. (2005). Millennial-scale depositional cycles from the Holocene of the Po Plain, Italy. Marine Geology, 222–223(1–4), 7–18. https://doi.org/10.1016/j.margeo.2005.06.041"
"Ausseil-Badie, J., Barusseau, J. P., Descamps, C., Salif Diop, E. H., Giresse, P., & Pazdur, M. (1991). Holocene Deltaic Sequence in the Saloum Estuary, Senegal. Quaternary Research, 36(PP0012), 178–194. https://doi.org/10.1016/0033-5894(91)90024-Y"
"Bobba, A. G. (n.d.). Simulation of Groundwater and Contamination Discharge from Krishna – Godavari Coast to Bay of Bengal , India, 23–40."
"Bonsor, H. C., MacDonald, A. M., Ahmed, K. M., Burgess, W. G., Basharat, M., Calow, R. C., et al. (2017). Hydrogeological typologies of the Indo-Gangetic basin alluvial aquifer, South Asia. Hydrogeology Journal, 25(5), 1377–1406. https://doi.org/10.1007/s10040-017-1550-z"
"Bridger, D. W., & Allen, D. M. (2006). An investigation into the effects of diffusion on salinity distribution beneath the Fraser River Delta, Canada. Hydrogeology Journal, 14(8), 1423–1442. https://doi.org/10.1007/s10040-006-0060-1"
"Clift, P. D., Giosan, L., Blusztajn, J., Campbell, I. H., Allen, C., Pringle, M., et al. (2008). Holocene erosion of the Lesser Himalaya triggered by intensified summer monsoon. Geology, 36(1), 79–82. https://doi.org/10.1130/G24315A.1"
"Colombani, N., Osti, A., Volta, G., & Mastrocicco, M. (2016). Impact of Climate Change on Salinization of Coastal Water Resources. Water Resources Management, 30(7), 2483–2496. https://doi.org/10.1007/s11269-016-1292-z"
"Cooke, G. A. (1985). Reconstruction of the Mesopotamian coastline in the Holocene. Geological Society of America Abstracts, 2(1), 15–28."
"Custodio, E. (2010). Coastal aquifers of Europe: an overview. Hydrogeology Journal, 18(1), 269–280. https://doi.org/10.1007/s10040-009-0496-1"
"Duque, C., Olsen, J. T., Sánchez-Úbeda, J. P., & Calvache, M. L. (2019). Groundwater salinity during 500 years of anthropogenic-driven coastline changes in the Motril-Salobreña aquifer (South East Spain). Environmental Earth Sciences, 78(15), 471. https://doi.org/10.1007/s12665-019-8476-9"
"Fanget, A. S., Bassetti, M. A., Fontanier, C., Tudryn, A., & Berné, S. (2016). Sedimentary archives of climate and sea-level changes during the Holocene in the Rhône prodelta (NW Mediterranean Sea). Climate of the Past, 12(12), 2161–2179. https://doi.org/10.5194/cp-12-2161-2016"
"Fass, T., Cook, P. G., Stieglitz, T., & Herczeg, A. L. (2007). Development of saline ground water through transpiration of sea water. Ground Water, 45(6), 703–710. https://doi.org/10.1111/j.1745-6584.2007.00344.x"
"Faye, S., Maloszewski, P., Stichler, W., Trimborn, P., Faye, S. C., & Gaye, C. B. (2005). Groundwater salinization in the Saloum (Senegal) delta aquifer: Minor elements and isotopic indicators. Science of the Total Environment, 343(1–3), 243–259. https://doi.org/10.1016/j.scitotenv.2004.10.001"
"Fielding, C. R., Trueman, J. D., & Alexander, J. (2006). Holocene Depositional History of the Burdekin River Delta of Northeastern Australia: A Model for a Low-Accommodation, Highstand Delta. Journal of Sedimentary Research, 76(3), 411–428. https://doi.org/10.2110/jsr.2006.032"
"Giao, P. H., Phien-Wej, N., & Honjo, Y. (1998). FEM quasi-3D modelling of responses to artificial recharge in the Bangkok multiaquifer system. Environmental Modelling and Software, 14(2–3), 141–151. https://doi.org/10.1016/S1364-8152(98)00065-6"
"Giosan, L., Naing, T., Tun, M. M., Clift, P. D., Filip, F., Constantinescu, S., et al. (2018). On the Holocene evolution of the Ayeyawady megadelta. Earth Surface Dynamics, 6(2), 451–466. https://doi.org/10.5194/esurf-6-451-2018"
"Goodbred, S. L., & Kuehl, S. A. (2000). The significance of large sediment supply, active tectonism, and eustasy on margin sequence development: Late Quaternary stratigraphy and evolution of the Ganges-Brahmaputra delta. Sedimentary Geology, 133(3–4), 227–248. https://doi.org/10.1016/S0037-0738(00)00041-5"
"Griffith, J. M. (2003). Hydrogeologic Framework of Southeastern Louisiana. Louisiana Department of Transportation and Development Water Resourcs Technical Report No. 72."
"Das Gupta, A. (1985). Simulated salt-water movement in the Nakhon Luang Aquifer, Bangkok, Thailand. Ground Water, 23(4)."
"de Haas, T., Pierik, H. J., van der Spek, A. J. F., Cohen, K. M., van Maanen, B., & Kleinhans, M. G. (2018). Holocene evolution of tidal systems in The Netherlands: Effects of rivers, coastal boundary conditions, eco-engineering species, inherited relief and human interference. Earth-Science Reviews, 177, 139–163. https://doi.org/10.1016/j.earscirev.2017.10.006"
"Han, D., Kohfahl, C., Song, X., Xiao, G., & Yang, J. (2011). Geochemical and isotopic evidence for palaeo-seawater intrusion into the south coast aquifer of Laizhou Bay, China. Applied Geochemistry, 26(5), 863–883. https://doi.org/10.1016/j.apgeochem.2011.02.007"
"Hehanussa, P. E. (1980). Appenndix 2: Excursion guide to the Cimanuk Delta complex, west Java. In Proceedings of the Jakarta workshop on coastal resources management."
"Hussein, M. T. (1982). Evaluation of groundwater resources in tokar delta, sudan. Hydrological Sciences Journal, 27(2), 139–145. https://doi.org/10.1080/02626668209491096"
"Iribar, V., Carrera, J., Custodio, E., & Medina, A. (1997). Inverse modelling of seawater intrusion in the Llobregat delta deep aquifer. Journal of Hydrology, 198(1–4), 226–244. https://doi.org/10.1016/S0022-1694(96)03290-8"
"Jassim, S., & Goff, J. (2006). Geology of Iraq. (S. Jassim & J. Goff, Eds.) (1st ed.). Brno, Czech Republic: Dolin."
"Jaworska-Szulc, B. (2009). Groundwater flow modelling of multi-aquifer systems for regional resources evaluation: The Gdansk hydrogeological system, Poland. Hydrogeology Journal, 17(6), 1521–1542. https://doi.org/10.1007/s10040-009-0473-8"
"Kagabu, M., Delinom, R. M., Lubis, R. F., Shimada, J., & Taniguchi, M. (2010). Groundwater Characteristics in Jakarta Area, Indonesia. Jurnal RISET Geologi Dan Pertambangan, 20(2), 69. https://doi.org/10.14203/risetgeotam2010.v20.35"
"Kozerski, B. (1983). PROBLEMS OF THE SALT WATER ORIGIN IN THE VISTULA DELTA AQUIFERS. In Proceedings of the 8th Salt Water Intrusion Meeting, Bari, Italy (pp. 325–334)."
"Kumar, B., Rao, M. S., Gupta, A. K., & Purushothaman, P. (2011). Groundwater management in a coastal aquifer in Krishna River Delta , South India using isotopic approach. Current Science, 100(7)."
"Kwong, H. T., Jiao, J. J., & Chan, L. S. (2016). A preliminary study on the offshore stratigraphy in Hong Kong and its hydrogeological implications. Environmental Earth Sciences, 75(11), 975. https://doi.org/10.1007/s12665-016-5749-4"
"Larsen, F., Tran, L. V., Van Hoang, H., Tran, L. T., Christiansen, A. V., & Pham, N. Q. (2017). Groundwater salinity influenced by Holocene seawater trapped in incised valleys in the Red River delta plain. Nature Geoscience, 10(May). https://doi.org/10.1038/ngeo2938"
"Makowska, A. (1991). Pleistocene marine deposits and their bearing on the stratigraphy of the Yougher Pleistocene in Dolne Powisle (North Poland). Kwartalnik Geologiczny, 35(1), 107–118."
"Manzano, M., Custodio, E., Loosli, H., Cabrera, M. C., Riera, X., & Custodio, J. (2001). Palaeowater in coastal aquifers of Spain. Geological Society, London, Special Publications, 189(1), 107–138. https://doi.org/10.1144/gsl.sp.2001.189.01.08"
"Mcmahon, G. A., Arunakumaren, N. J., & Bajracharya, K. (2000). Hydrogeological Conceptualisation of the Burdekin River Delta. In Proceedings f the 3rd international Hydrology and Water Resources Symposium of the Institution of Engineers, Perth, Western Australia, Australia."
"Michael, H. A., & Voss, C. I. (2009). Estimation of regional-scale groundwater flow properties in the Bengal Basin of India and Bangladesh. Hydrogeology Journal, 17(6), 1329–1346. https://doi.org/10.1007/s10040-009-0443-1"
"Minderhoud, P. S. J., Erkens, G., Pham, V. H., Bui, V. T., Erban, L., Kooi, H., & Stouthamer, E. (2017). Impacts of 25 years of groundwater extraction on subsidence in the Mekong delta, Vietnam. Environmental Research Letters, 12(6), 64006. https://doi.org/doi.org/10.1088/1748-9326/aa7146"
"de Montety, V., Radakovitch, O., Vallet-Coulomb, C., Blavoux, B., Hermitte, D., & Valles, V. (2008). Origin of groundwater salinity and hydrogeochemical processes in a confined coastal aquifer: Case of the Rhône delta (Southern France). Applied Geochemistry, 23(8), 2337–2349. https://doi.org/10.1016/j.apgeochem.2008.03.011"
"Narayan, K. A., Schleeberger, C., & Bristow, K. L. (2007). Modelling seawater intrusion in the Burdekin Delta Irrigation Area, North Queensland, Australia. Agricultural Water Management, 89(3), 217–228. https://doi.org/10.1016/j.agwat.2007.01.008"
"Naseem, S., Husain, V., & Bano, S. (2018). Origin of Salinity and Other Constituents in Indus Deltaic Plain Groundwater, Thatta District, Pakistan. Journal of Coastal Research, 344(4), 883–891. https://doi.org/10.2112/jcoastres-d-17-00052.1"
"Nguyen, A. D., & Savenije, H. H. G. (2006). Salt intrusion in multi-channel estuaries: a case study in the {Mekong} {Delta}, {Vietnam}. Hess, 10, 743–754. https://doi.org/10.5194/hessd-3-499-2006"
"Onodera, S. ichi, Saito, M., Sawano, M., Hosono, T., Taniguchi, M., Shimada, J., et al. (2009). Erratum to “Effects of intensive urbanization on the intrusion of shallow groundwater into deep groundwater: Examples from Bangkok and Jakarta” (DOI:10.1016/j.scitotenv.2008.08.003). Science of the Total Environment, 407(9), 3209–3217. https://doi.org/10.1016/j.scitotenv.2009.01.049"
"Oude Essink, G. H. P., Van Baaren, E. S., & De Louw, P. G. B. (2010). Effects of climate change on coastal groundwater systems: A modeling study in the Netherlands. Water Resources Research, 46(10), 1–16. https://doi.org/10.1029/2009WR008719"
"Pennington, B. T., Sturt, F., Wilson, P., Rowland, J., & Brown, A. G. (2017). The fluvial evolution of the Holocene Nile Delta. Quaternary Science Reviews, 170, 212–231. https://doi.org/10.1016/j.quascirev.2017.06.017"
"Van Pham, H., van Geer, F. C., Tran, V. B., Dubelaar, W., & Oude Essink, G. H. P. (2019). Paleo-hydrogeological reconstruction of the fresh-saline groundwater distribution in the Vietnamese Mekong Delta since the late Pleistocene. Journal of Hydrology: Regional Studies, 23, 22."
"Prabaharan, S., Lakshumanan, C., & Subramani, T. (2018). Geomorphic Anomalies and Natural Resource of Krishna Godavari Basin Using Remote Sensing Techniques. International Journal of Earth Sciences and Engineering, 11(01), 35–40. https://doi.org/10.21276/ijee.2018.11.0106"
"Ricketts, B. D. (1998). Geological setting of the Fraser River delta. In J. J. Clague, J. L. Luternauer, & D. C. Mosher (Eds.), Geology and Natural Hazards of the Fraser River Delta, British Columbia (pp. 7–16). Bulletin of the Geological Survey of Canada."
"Sahoo, S., & Jha, M. K. (2017). Numerical groundwater-flow modeling to evaluate potential effects of pumping and recharge: implications for sustainable groundwater management in the Mahanadi delta region, IndiaModélisation numérique des écoulements d’eau souterraine pour évaluer les eff. Hydrogeology Journal, 25(8), 2489–2511. https://doi.org/10.1007/s10040-017-1610-4"
"Saito, Y., Yang, Z., & Hori, K. (2001). The Huanghe Yellow River and Changjiang Yangtze River deltas: a review on their characteristics, evolution and sediment discharge during the Holocene. Geomorphology, 41, 219–231."
"Samsudin, A. R., Haryono, A., Hamzah, U., & Rafek, A. G. (2008). Salinity mapping of coastal groundwater aquifers using hydrogeochemical and geophysical methods: A case study from north Kelantan, Malaysia. Environmental Geology, 55(8), 1737–1743. https://doi.org/10.1007/s00254-007-1124-9"
"Samsudin, Abdul Rahim, Hamzah, U., & Rafek, G. (1997). Salinity study of coastal groundwater aquifers in north Kelantan , Malaysia. Abbual Geological Conference ’97."
"Sanford, W. E., & Buapeng, S. (1996). Assessment of a groundwater flow model of the bangkok basin, Thailand. Hydrogeology Journal, 4(4)."
"Savenije, H. H. G. (2012). Salinity and tides in alluvial estuaries. Open Access. https://doi.org/http://dx.doi.org/10.1016/B978-044452107-1/50006-X"
"Sestini, G. (1989). Nile Delta: a review of depositional environments and geological history. Geological Society, London, Special Publications, 41(1), 99–127. https://doi.org/10.1144/GSL.SP.1989.041.01.09"
"Shi, X., Fang, R., Wu, J., Xu, H., Sun, Y. Y., & Yu, J. (2012). Sustainable development and utilization of groundwater resources considering land subsidence in Suzhou, China. Engineering Geology, 124(1), 77–89. https://doi.org/10.1016/j.enggeo.2011.10.005"
"Sinsakul, S. (2000). Late Quaternary geology of the Lower Central Plain, Thailand. Journal of Asian Earth Sciences, 18(4), 415–426. https://doi.org/10.1016/S1367-9120(99)00075-9"
"Stanley, D. J., & Warne, A. G. (1993). Nile Delta: Recent Geological Evolution and Human Impact. Science, 260(5108), 628–634. https://doi.org/10.1126/science.260.5108.628"
"Szpakowski, W. (2007). Numerical simulation of the Quaternary Aquifer groundwater flow of Northern Vistula delta plain. TASK Quarterly, 11(4), 411–424."
"Tamura, T., Saito, Y., Sieng, S., Ben, B., Kong, M., Sim, I., et al. (2009). Initiation of the Mekong River delta at 8 ka: evidence from the sedimentary succession in the Cambodian lowland. Quaternary Science Reviews, 28(3–4), 327–344. https://doi.org/10.1016/j.quascirev.2008.10.010"
"Teatini, P., Castelletto, N., Ferronato, M., Gambolati, G., & Tosi, L. (2011). A new hydrogeologic model to predict anthropogenic uplift of Venice. Water Resources Research, 47(12), 1–17. https://doi.org/10.1029/2011WR010900"
"Thompson, C., Smith, L., & Maji, R. (2007). Hydrogeological modeling of submarine groundwater discharge on the continental shelf of Louisiana. Journal of Geophysical Research: Oceans, 112(3), 1–13. https://doi.org/10.1029/2006JC003557"
"UN-ESCWA, & BGR. (2013). Neogene Aquifer System Dibdibba-Kuwait Group (South-East): Dibdibba Delta Basin. Inventory of Shared Water Resources in Western Asia."
"Viossanges, M., Johnston, R., & Drury, L. (2017). SOBA 2A: Groundwater Resources. AYEYARWADY STATE OF THE BASIN ASSESSMENT (SOBA) (Vol. 2). https://doi.org/10.1016/S0167-5648(08)70868-2"
"Wang, Y., & Jiao, J. J. (2012). Origin of groundwater salinity and hydrogeochemical processes in the confined Quaternary aquifer of the Pearl River Delta, China. Journal of Hydrology, 438–439, 112–124. https://doi.org/10.1016/j.jhydrol.2012.03.008"
"Winkel, L. H. E., Pham, T. K. T., Vi, M. L., Stengel, C., Amini, M., Nguyen, T. H., et al. (2011). Arsenic pollution of groundwater in Vietnam exacerbated by deep aquifer exploitation for more than a century. Proceedings of the National Academy of Sciences of the United States of America, 108(4), 1246–1251. https://doi.org/10.1073/pnas.1011915108"
"Xue, Y. Q., Wu, J. C., Zhang, Y., Ye, S. J., Shi, X. Q., Wei, Z. X., et al. (2008). Simulation of regional land subsidence in the southern Yangtze Delta. Science in China, Series D: Earth Sciences, 51(6), 808–825. https://doi.org/10.1007/s11430-008-0062-z"
"Yidana, S. M., & Chegbeleh, L. P. (2013). The hydraulic conductivity field and groundwater flow in the unconfined aquifer system of the Keta Strip, Ghana. Journal of African Earth Sciences, 86, 45–52. https://doi.org/10.1016/j.jafrearsci.2013.06.009"
"Yoo, D.-G., Lee, G.-S., Kang, N.-K., Yi, B.-Y., Kong, G.-S., Kim, G.-Y., et al. (2017). Stratigraphy and depositional history of Nakdong River Delta. Journal of the Geological Society of Korea, 53(5), 619–630. https://doi.org/10.14770/jgsk.2017.53.5.619"
"Zong, Y., Huang, G., Switzer, A. D., Yu, F., & Yim, W. W. S. (2009). An evolutionary model for the Holocene formation of the Pearl River delta, China. Holocene, 19(1), 129–142. https://doi.org/10.1177/0959683608098957"
"Zong, Yongqiang, Huang, K., Yu, F., Zheng, Z., Switzer, A., Huang, G., et al. (2012). The role of sea-level rise, monsoonal discharge and the palaeo-landscape in the early Holocene evolution of the Pearl River delta, southern China. Quaternary Science Reviews, 54, 77–88. https://doi.org/10.1016/j.quascirev.2012.01.002"




